id,title,year,title,maize,sorghum,millets,rice,soybean,other-crops,association-studies,genomics,transcriptomics,image-analysis,quantitative-genetics,ai-ml,engineering,comparative-genomics,genome-editing,genotype-environment-interaction,flowering-time,stress-tolerance,photosynthesis,microbiome,nitrogen,phenomics,review-methods,data-release2026-qc-genomes-to-fields-competition,Genomes to Fields 2024 Maize Genotype by Environment Prediction Competition,2026,Genomes to Fields 2024 Maize Genotype by Environment Prediction Competition,x,,,,,,,,,,,,,,,,,,,,,,,x2025-m-food-as-medicine,Food as Medicine: Enhancing Crop Breeding and Food Processing to Shift the Gut Microbiome for Pre...,2025,Food as Medicine: Enhancing Crop Breeding and Food Processing to Shift the Gut Microbiome for Pre...,,,,,,,,,,,,,,,,,,,,x,,,x,2025-n-offtheshelf-image-analysis,Off-the-shelf image analysis models outperform human visual assessment in identifying genes contr...,2025,Off-the-shelf image analysis models outperform human visual assessment in identifying genes contr...,,x,,,,,x,,,x,,,,,,,,,,,,x,,2025-v-genetic-variation-and-historical,Genetic variation and historical breeding patterns in common bean (Phaseolus vulgaris L.) affect ...,2025,Genetic variation and historical breeding patterns in common bean (Phaseolus vulgaris L.) affect ...,,,,,,x,x,,,,,,,,,,,,,x,,,,2025-w-quantitative-genetics-of,Quantitative genetics of photosynthetic trait variation in maize.,2025,Quantitative genetics of photosynthetic trait variation in maize.,x,,,,,,x,,,,,,,,,,,,x,,,,,2025-h-genes-and-pathways,Genes and pathways determining flowering time variation in temperate adapted sorghum.,2025,Genes and pathways determining flowering time variation in temperate adapted sorghum.,,x,,,,,x,,x,,,,,,,,x,,,,,,,2025-d-heritability-heterosis-and,"Heritability, heterosis, and hybrid/inbred classification ability of maize leaf hyperspectral sig...",2025,"Heritability, heterosis, and hybrid/inbred classification ability of maize leaf hyperspectral sig...",x,,,,,,,,,,x,,,,,,,,,,x,x,,2025-n-plotlevel-satellite-imagery,Plot-level satellite imagery can substitute for UAVs in assessing maize phenotypes across multist...,2025,Plot-level satellite imagery can substitute for UAVs in assessing maize phenotypes across multist...,x,,,,,,,,,x,,,,,,,,,,,,x,x,x2025-jm-assessing-the-impact,Assessing the impact of yield plasticity on hybrid performance in maize.,2025,Assessing the impact of yield plasticity on hybrid performance in maize.,x,,,,,,,,,,x,,,,,x,,,,,,,,2025-rk-transcripts-and-genomic,Transcripts and genomic intervals associated with variation in metabolite abundance in maize leav...,2025,Transcripts and genomic intervals associated with variation in metabolite abundance in maize leav...,x,,,,,,x,x,,,,,,,,,,,,,,,,2025-jm-d-reconstruction-enables,3D reconstruction enables high-throughput phenotyping and quantitative genetic analysis of phyllo...,2025,3D reconstruction enables high-throughput phenotyping and quantitative genetic analysis of phyllo...,,x,,,,,,,,x,,,,,,,,,,,,x,x,2025-f-nighttime-fluorescence-phenotyping,Nighttime fluorescence phenotyping reduces environmental variability for photosynthetic traits an...,2025,Nighttime fluorescence phenotyping reduces environmental variability for photosynthetic traits an...,x,,,,,,,,,,,,,,,,,,x,,,,,2025-jv-evolving-best-practices,Evolving best practices for transcriptome-wide association studies accelerate discovery of gene-p...,2025,Evolving best practices for transcriptome-wide association studies accelerate discovery of gene-p...,x,,,,,,x,,x,,,,,,,,,,,,,,x,2025-h-nitrogen-response-and,Nitrogen response and growth trajectory of sorghum CRISPR-Cas9 mutants using high-throughput phen...,2025,Nitrogen response and growth trajectory of sorghum CRISPR-Cas9 mutants using high-throughput phen...,,x,,,,,,,,,,,,,x,,,,,,x,,,2025-zhongjie-scalable-methods-for,Scalable methods for quantifying the stay green ability of corn for yield prediction by using sat...,2025,Scalable methods for quantifying the stay green ability of corn for yield prediction by using sat...,x,,,,,,,,,x,,x,,,,,,,,,,x,,2025-h-maizeearsam-zeroshot-maize,MaizeEar-SAM: Zero-shot maize ear phenotyping.,2025,MaizeEar-SAM: Zero-shot maize ear phenotyping.,x,,,,,,,,,,,x,,,,,,,,,,x,,2025-a-enhancing-yield-prediction,Enhancing yield prediction from plot-level satellite imagery through genotype and environment fea...,2025,Enhancing yield prediction from plot-level satellite imagery through genotype and environment fea...,x,,,,,,,,,x,x,x,,,,x,,,,,,x,,2025-jo-designing-a-nitrogen,Designing a nitrogen efficient cold tolerant maize for modern agricultural systems.,2025,Designing a nitrogen efficient cold tolerant maize for modern agricultural systems.,x,,,,,,,,,,,,,,,,,x,,,x,,x,2025-k-employing-spectral-features,Employing spectral features to accelerate sorghum phenotyping against sap-feeding aphids.,2025,Employing spectral features to accelerate sorghum phenotyping against sap-feeding aphids.,,x,,,,,,,,,,,,,,,,,,,,x,,2025-tn-in-context-promoter,In context promoter bashing of the Sorghum bicolor gene models functionally annotated as bundle s...,2025,In context promoter bashing of the Sorghum bicolor gene models functionally annotated as bundle s...,,x,,,,,,,,,,,,,x,,,,x,,,,,2025-f-phenotypic-plasticity-in,Phenotypic plasticity in maize grain yield: genetic and environmental insights of response to env...,2025,Phenotypic plasticity in maize grain yield: genetic and environmental insights of response to env...,x,,,,,,,x,,,,,,,,x,,,,,,,,2025-p-positioning-accuracy-of,Positioning accuracy of RTK-GNSS-enabled drones and their performance in agricultural crop sensing.,2025,Positioning accuracy of RTK-GNSS-enabled drones and their performance in agricultural crop sensing.,,,,,,,,,,,,,,,,,,,,,,x,,2025-mc-predicting-complex-phenotypes,Predicting complex phenotypes using multi-omics data in maize.,2025,Predicting complex phenotypes using multi-omics data in maize.,x,,,,,,,,x,,x,,,,,,,,,,,,,2025-n-sequence-based-classifier,A sequence-based classifier distinguishes phenotype-associated genes from other gene models in pl...,2025,A sequence-based classifier distinguishes phenotype-associated genes from other gene models in pl...,,,,,,,,x,,,,x,,x,,,,,,,,,,2025-a-unveiling-shared-genetic,Unveiling shared genetic regulators for plant architectural and biomass yield traits in sorghum.,2025,Unveiling shared genetic regulators for plant architectural and biomass yield traits in sorghum.,,x,,,,,x,,,,x,,,,,,,,,,,x,,2023-j-phenotypic-variation-in,Phenotypic variation in maize can be largely explained by genetic variation at transcription fact...,2025,Phenotypic variation in maize can be largely explained by genetic variation at transcription fact...,x,,,,,,,x,,,,,,,,,,,,,,,,2024-jv-population-level-gene,Population level gene expression can repeatedly link genes to functions in maize.,2024,Population level gene expression can repeatedly link genes to functions in maize.,x,,,,,,x,,x,,,,,,,,x,,,,,,,2024-mc-data-driven-discovery,Data driven discovery and quantification of hyperspectral leaf reflectance phenotypes across a ma...,2024,Data driven discovery and quantification of hyperspectral leaf reflectance phenotypes across a ma...,x,,,,,,,,,,x,x,,,,,,,,,,x,,2024-n-genomic-colocalization-of,Genomic co-localization of variation affecting agronomic and human gut microbiome traits in a met...,2024,Genomic co-localization of variation affecting agronomic and human gut microbiome traits in a met...,,x,,,,,,x,,,,,,,,,,,,x,,,,2024-h-imitating-the-breeders,"Imitating the ""breeder’s eye"": predicting grain yield from measurements of non-yield traits.",2024,"Imitating the ""breeder’s eye"": predicting grain yield from measurements of non-yield traits.",x,,,,,,,,,,x,x,,,,,,,,,,,,2024-mc-models-trained-to,Models trained to predict differential expression across plant organs identify distal and proxima...,2024,Models trained to predict differential expression across plant organs identify distal and proxima...,,,,,,,,,x,,,x,,,,,,,,,,,,2024-skk-rhythmic-lipid-and,Rhythmic lipid and gene expression responses to chilling in panicoid grasses.,2024,Rhythmic lipid and gene expression responses to chilling in panicoid grasses.,x,x,,,,,,,x,,,,,x,,,,x,,,,,,2024-h-thi-gene-evolutionary,THI1 gene evolutionary trends: A comprehensive plant-focused Assessment via data Mining and large...,2024,THI1 gene evolutionary trends: A comprehensive plant-focused Assessment via data Mining and large...,,,,,,,,x,,,,,,,,,,,,x,,,,2024-km-variation-in-leaf,Variation in leaf chlorophyll concentration in response to nitrogen application across maize hybr...,2024,Variation in leaf chlorophyll concentration in response to nitrogen application across maize hybr...,x,,,,,,,,,,,,,,,,,,x,,x,,,2024-d-twas-facilitates-genescale,"TWAS facilitates gene-scale trait genetic dissection through gene expression, structural variatio...",2024,"TWAS facilitates gene-scale trait genetic dissection through gene expression, structural variatio...",,,,,x,,x,,x,,,,,,,,,,,,,,,2024-s-nonphotochemical-quenching-kinetics,Nonphotochemical quenching kinetics GWAS in sorghum identifies genes that may play conserved role...,2024,Nonphotochemical quenching kinetics GWAS in sorghum identifies genes that may play conserved role...,x,x,,,,,x,,,,,,,x,,,,,x,,,,,2024-i-sorghum-segmentation-and,Sorghum segmentation and leaf counting using an in silico trained deep neural model.,2024,Sorghum segmentation and leaf counting using an in silico trained deep neural model.,,x,,,,,,,,x,,x,,,,,,,,,,,,2024-a-disentangling-genotype-and,Disentangling genotype and environment specific latent features for improved trait prediction usi...,2024,Disentangling genotype and environment specific latent features for improved trait prediction usi...,,,,,,,,,,,x,x,,,,x,,,,,,,,2024-s-genotypespecific-nonphotochemical-quenching,Genotype-specific nonphotochemical quenching responses to nitrogen deficit are linked to chloroph...,2024,Genotype-specific nonphotochemical quenching responses to nitrogen deficit are linked to chloroph...,x,,,,,,,,,,,,,,,,,,x,,x,,,2024-y-dissecting-the-genetic,Dissecting the genetic architecture of sunflower disc diameter using genome-wide association study.,2024,Dissecting the genetic architecture of sunflower disc diameter using genome-wide association study.,,,,,,x,x,,,,,,,,,,,,,,,,,2024-j-genetic-and-environmental,Genetic and environmental patterns underlying phenotypic plasticity in flowering time and plant h...,2024,Genetic and environmental patterns underlying phenotypic plasticity in flowering time and plant h...,,x,,,,,,,,,,,,,,x,x,,,,,,,2024-r-genomewide-association-study,Genome-wide association study reveals marker-trait associations for major agronomic traits in pro...,2024,Genome-wide association study reveals marker-trait associations for major agronomic traits in pro...,,,x,,,,x,,,,,,,,,,,,,,,,,2024-l-gwas-analysis-for,GWAS analysis for plant height and stem diameter in sorghum using multiple phenotyping approaches.,2024,GWAS analysis for plant height and stem diameter in sorghum using multiple phenotyping approaches.,,x,,,,,x,,,,,,,,,,,,,,,,,2024-g-highthroughput-physiological-phenotyping,High-throughput physiological phenotyping of crop evapotranspiration at the plot scale.,2024,High-throughput physiological phenotyping of crop evapotranspiration at the plot scale.,,,,,,,,,,x,,,,,,,,,,,,x,,2024-e-image-filtering-to,Image filtering to improve maize tassel detection accuracy using machine learning algorithms.,2024,Image filtering to improve maize tassel detection accuracy using machine learning algorithms.,x,,,,,,,,,x,,,,,,,,,,,,,,2024-r-optimizing-feature-selection,Optimizing feature selection with gradient boosting machines in PLS regression for predicting moi...,2024,Optimizing feature selection with gradient boosting machines in PLS regression for predicting moi...,x,,,,,,,,,,,,,,,,,,,,,,,2024-a-plantsegnet-d-point,PlantSegNet: 3D point cloud instance segmentation of nearby plant organs with identical semantics.,2024,PlantSegNet: 3D point cloud instance segmentation of nearby plant organs with identical semantics.,,,,,,,,,,x,,x,,,,,,,,,,x,,2023-g-a-role-for,A role for heritable transcriptomic variation in maize adaptation to temperate environments.,2023,A role for heritable transcriptomic variation in maize adaptation to temperate environments.,x,,,,,,,x,x,,x,,,,,,,,,,,,,2023-m-a-common-resequencingbased,A common resequencing-based genetic marker dataset for global maize diversity.,2023,A common resequencing-based genetic marker dataset for global maize diversity.,x,,,,,,,x,,,x,,,,,,,,,,,,,x2023-s-genetic-control-of,Genetic control of photoprotection and photosystem II operating efficiency in plants.,2023,Genetic control of photoprotection and photosystem II operating efficiency in plants.,x,,,,,,x,,,,,,,,,,,,x,,,,,2023-m-multiview-triangulation-without,Multi-view triangulation without correspondences.,2023,Multi-view triangulation without correspondences.,,,,,,,,,,x,,,,,,,,,,,,x,,2023-dc-field-seasons-of,2018–2019 field seasons of the Maize Genomes to Fields (G2F) G x E project.,2023,2018–2019 field seasons of the Maize Genomes to Fields (G2F) G x E project.,x,,,,,,,,,,,,,,,,,,,,,,,x2023-dc-field-seasons-of,2020-2021 field seasons of Maize GxE project within the Genomes to Fields Initiative.,2023,2020-2021 field seasons of Maize GxE project within the Genomes to Fields Initiative.,x,,,,,,,,,,,,,,,,,,,,,,,x2023-j-a-complete-telomeretotelomere,A complete telomere-to-telomere assembly of the maize genome.,2023,A complete telomere-to-telomere assembly of the maize genome.,x,,,,,,,x,,,,,,,,,,,,,,,,2023-nk-a-leaflevel-spectral,A leaf-level spectral library to support high throughput plant phenotyping: Predictive accuracy a...,2023,A leaf-level spectral library to support high throughput plant phenotyping: Predictive accuracy a...,x,x,,,,,,,,x,,,,,,,,,,,,x,,x2023-m-localization-of-crop,Localization of crop damage utilizing a wake up gas sensor network.,2023,Localization of crop damage utilizing a wake up gas sensor network.,,,,,,,,,,,,,x,,,,,,,,,,,2023-r-multiple-highly-expressed,Multiple highly expressed phosphoenolpyruvate carboxylase genes have divergent enzyme kinetic pro...,2023,Multiple highly expressed phosphoenolpyruvate carboxylase genes have divergent enzyme kinetic pro...,,,,,,,,,,,,,,,,,,,x,,,,,2023-ac-oligogalactolipid-production-during,Oligogalactolipid production during cold challenge is conserved in early diverging lineages.,2023,Oligogalactolipid production during cold challenge is conserved in early diverging lineages.,,,,,,,,,,,,,,,,,,x,,,,,,2023-c-role-of-the,Role of the genomics–phenomics–agronomy paradigm in plant breeding.,2023,Role of the genomics–phenomics–agronomy paradigm in plant breeding.,,,,,,,,,,,,,,,,,,,,,,,x,2023-d-yield-prediction-through,"Yield prediction through integration of genetic, environment, and management data through deep le...",2023,"Yield prediction through integration of genetic, environment, and management data through deep le...",,,,,,,,,,,,x,,,,x,,,,,,,,2022-rv-association-mapping-across,Association mapping across a multitude of traits collected in diverse environments identifies ple...,2022,Association mapping across a multitude of traits collected in diverse environments identifies ple...,x,,,,,,x,,,,,,,,,,,,,,,,,x2022-g-genome-of-paspalum,Genome of Paspalum vaginatum and the role of trehalose mediated autophagy in increasing maize bio...,2022,Genome of Paspalum vaginatum and the role of trehalose mediated autophagy in increasing maize bio...,,,,,,,,x,,,,,,,,,,x,,,x,,,2022-m-variation-in-morphophysiological,Variation in morpho-physiological and metabolic responses to low nitrogen stress across the sorgh...,2022,Variation in morpho-physiological and metabolic responses to low nitrogen stress across the sorgh...,,x,,,,,,,,,x,,,,,,,x,,,x,,,2022-rv-can-the-grains,Can the grains offer each other helping hands? Convergent molecular mechanisms associated with do...,2022,Can the grains offer each other helping hands? Convergent molecular mechanisms associated with do...,,,,,,,,,,,,,,x,,,,,,,,,x,2022-n-the-unique-seed,The unique seed protein composition of quality protein popcorn promotes growth of beneficial bact...,2022,The unique seed protein composition of quality protein popcorn promotes growth of beneficial bact...,x,,,,,,,,,,,,,,,,,,,x,,,,2022-r-snp-discovery-in,SNP Discovery in Proso millet (Panicum miliaceum L.) using low-pass genome sequencing.,2022,SNP Discovery in Proso millet (Panicum miliaceum L.) using low-pass genome sequencing.,,,x,,,,,,,,,,,,,,,,,,,,,2022-m-maize-rootassociated-microbes,Maize root-associated microbes likely under adaptive selection by the host to enhance phenotypic ...,2022,Maize root-associated microbes likely under adaptive selection by the host to enhance phenotypic ...,x,,,,,,,,,,x,,,,,,,,,x,,,,2022-h-pervasive-misannotation-of,Pervasive misannotation of microexons that are evolutionarily conserved and crucial for gene func...,2022,Pervasive misannotation of microexons that are evolutionarily conserved and crucial for gene func...,,,,,,,,x,,,,,,,,,,,,,,,,2022-l-sorghum-association-panel,Sorghum association panel whole-genome sequencing establishes pivotal resource for dissecting gen...,2022,Sorghum association panel whole-genome sequencing establishes pivotal resource for dissecting gen...,,x,,,,,,,,,,,,,,,,,,,,,,x2022-e-a-uavbased-highthroughput,A UAV-based high-throughput phenotyping approach to assess time-series nitrogen responses and ide...,2022,A UAV-based high-throughput phenotyping approach to assess time-series nitrogen responses and ide...,x,,,,,,,,,x,,,,,,,,,,,x,x,,2022-sh-field-deployment-of,Field deployment of a nanogap gas sensor for crop damage detection.,2022,Field deployment of a nanogap gas sensor for crop damage detection.,,,,,,,,,,,,,x,,,,,,,,,,,2022-q-genetic-analysis-of,Genetic analysis of seed traits in Sorghum bicolor that affect the human gut microbiome.,2022,Genetic analysis of seed traits in Sorghum bicolor that affect the human gut microbiome.,,x,,,,,,,,,,,,,,,,,,x,,,,2022-k-the-genome-of,The genome of Orychophragmus violaceus provides genomic insights into the evolution of Brassicace...,2022,The genome of Orychophragmus violaceus provides genomic insights into the evolution of Brassicace...,,,,,,,,x,,,,,,,,,,,,,,,,2022-d-time-series-canopy,Time series canopy phenotyping enables the identification of genetic variants controlling dynamic...,2022,Time series canopy phenotyping enables the identification of genetic variants controlling dynamic...,,,,,x,,x,,,,,,,,,,,,,,,,,2021-x-predicting-transcriptional-responses,Predicting transcriptional responses to cold stress across plant species.,2021,Predicting transcriptional responses to cold stress across plant species.,x,x,,,,,,,,,,x,,x,,,,,,,,,,2021-mc-d-reconstruction-identifies,3D reconstruction identifies loci linked to variation in angle of individual sorghum leaves.,2021,3D reconstruction identifies loci linked to variation in angle of individual sorghum leaves.,,x,,,,,x,,,,,,,,,,,,,,,x,,2021-rv-metaanalysis-identifies-pleiotropic,Meta-analysis identifies pleiotropic loci controlling phenotypic trade-offs in sorghum.,2021,Meta-analysis identifies pleiotropic loci controlling phenotypic trade-offs in sorghum.,,x,,,,,x,,,,x,,,,,,,,,,,,,x2021-g-quantitative-resistance-loci,Quantitative resistance loci to southern rust mapped in a temperate maize diversity panel.,2021,Quantitative resistance loci to southern rust mapped in a temperate maize diversity panel.,x,,,,,,x,,,,,,,,,,,,,,,,,2021-x-hour-diurnal-rnaseq,"72-hour diurnal RNA-seq analysis of fully expanded third leaves from maize, sorghum, and foxtail ...",2021,"72-hour diurnal RNA-seq analysis of fully expanded third leaves from maize, sorghum, and foxtail ...",,,,,,,,,x,,,,,,,,,,,,,,,x2021-c-automation-of-leaf,Automation of leaf counting in maize and sorghum using deep learning.,2021,Automation of leaf counting in maize and sorghum using deep learning.,x,x,,,,,,,,x,,x,,,,,,,,,,,,2021-m-hyperspectral-reflectancebased-phenotyping,Hyperspectral reflectance-based phenotyping for quantitative genetics in crops: progress and chal...,2021,Hyperspectral reflectance-based phenotyping for quantitative genetics in crops: progress and chal...,,,,,,,,,,x,,,,,,,,,,,,,x,2021-dd-comparative-transcriptome-analysis,Comparative transcriptome analysis reveals genetic mechanisms of sugarcane aphid resistance in gr...,2021,Comparative transcriptome analysis reveals genetic mechanisms of sugarcane aphid resistance in gr...,,x,,,,,,,x,,,,,,,,,,,,,,,2021-l-a-coopted-steroid,"A co-opted steroid synthesis gene, maintained in sorghum but not maize, is associated with a dive...",2021,"A co-opted steroid synthesis gene, maintained in sorghum but not maize, is associated with a dive...",x,x,,,,,,,,,,,,x,,,,,,,,,,2021-s-can-high-resolution,Can high resolution satellite imagery be used in high-throughput field phenotyping.,2021,Can high resolution satellite imagery be used in high-throughput field phenotyping.,x,,,,,,,,,x,,,,,,,,,,,,x,,2021-y-continuous-in-situ,Continuous in situ soil nitrate sensors: a comparison with conventional measurements and the valu...,2021,Continuous in situ soil nitrate sensors: a comparison with conventional measurements and the valu...,,,,,,,,,,,,,x,,,,,,,,x,,,2021-s-dct-a-new,DCT4 - a new member of the dicarboxylate transporter family in C4 grasses.,2021,DCT4 - a new member of the dicarboxylate transporter family in C4 grasses.,,,,,,,,x,,,,,,x,,,,,x,,,,,2021-sh-development-of-a,Development of a gas sensor for green leaf volatile detection.,2021,Development of a gas sensor for green leaf volatile detection.,,,,,,,,,,,,,x,,,,,,,,,,,2021-x-genomewide-dna-polymorphism,Genome-wide DNA polymorphism analysis and molecular marker development for the Setaria italica va...,2021,Genome-wide DNA polymorphism analysis and molecular marker development for the Setaria italica va...,,,x,,,,,x,,,,,,,,,,,,,,,,2021-m-genomic-resources-in,Genomic resources in plant breeding for sustainable agriculture.,2021,Genomic resources in plant breeding for sustainable agriculture.,,,,,,,,,,,,,,,,,,,,,,,x,2021-y-identification-and-utilization,Identification and utilization of genetic determinants of trait measurement errors in image-based...,2021,Identification and utilization of genetic determinants of trait measurement errors in image-based...,x,,,,,,,,,x,x,,,,,,,,,,,x,,2021-a-maize-tassel-detection,Maize tassel detection from UAV imagery using deep learning.,2021,Maize tassel detection from UAV imagery using deep learning.,x,,,,,,,,,x,,x,,,,,,,,,,,,2021-rj-phosphoenolpyruvate-carboxylase-kinetic,Phosphoenolpyruvate carboxylase kinetic variation provides opportunity to enhance C4 photosynthet...,2021,Phosphoenolpyruvate carboxylase kinetic variation provides opportunity to enhance C4 photosynthet...,,,,,,,,,,,,,,,,,,,x,,,,,2021-ma-rhizosphere-microbiomes-in,Rhizosphere microbiomes in a historical maize/soybean rotation system respond to host species and...,2021,Rhizosphere microbiomes in a historical maize/soybean rotation system respond to host species and...,x,,,,x,,,,,,,,,,,,,,,x,x,,,2021-ar-the-importance-of,The importance of dominance and genotype-by-environment interactions on grain yield variation in ...,2021,The importance of dominance and genotype-by-environment interactions on grain yield variation in ...,x,,,,,,,,,,x,,,,,,,,,,,,,2021-d-utility-of-climatic,Utility of climatic information via combining ability models to improve genomic prediction for yi...,2021,Utility of climatic information via combining ability models to improve genomic prediction for yi...,x,,,,,,,,,,,,,,,x,,,,,,,,2021-mr-qteller-a-tool,qTeller: A tool for comparative multi-genomic gene expression analysis.,2021,qTeller: A tool for comparative multi-genomic gene expression analysis.,x,,,,,,,x,x,,,,,,,,,,,,,,,2021-a-robotic-technologies-for,Robotic technologies for high-throughput plant phenotyping: reviews and perspectives.,2021,Robotic technologies for high-throughput plant phenotyping: reviews and perspectives.,,,,,,,,,,,,,x,,,,,,,,,x,x,2020-x-interspecific-analysis-of,Interspecific analysis of diurnal gene regulation in panicoid grasses identifies known and novel ...,2020,Interspecific analysis of diurnal gene regulation in panicoid grasses identifies known and novel ...,x,x,,,,,,,x,,,,,x,,,,,,,,,,2020-ds-isoseq-transcriptome-assembly,IsoSeq transcriptome assembly of C3 panicoid grasses provides tools to study evolutionary change ...,2020,IsoSeq transcriptome assembly of C3 panicoid grasses provides tools to study evolutionary change ...,,,,,,,,x,x,,,,,x,,,,,,,,,,2020-skk-leaf-angle-extractor,Leaf Angle eXtractor - A high throughput image processing framework for leaf angle measurement in...,2020,Leaf Angle eXtractor - A high throughput image processing framework for leaf angle measurement in...,,,,,,,,,,x,,,,,,,,,,,,,,2020-c-semantic-segmentation-of,Semantic segmentation of sorghum using hyperspectral data identifies genetic associations.,2020,Semantic segmentation of sorghum using hyperspectral data identifies genetic associations.,,x,,,,,,,,x,,x,,,,,,,,,,x,,2020-z-genomephenome-wide-association,Genome-phenome wide association in maize and arabidopsis identifies a common molecular and evolut...,2020,Genome-phenome wide association in maize and arabidopsis identifies a common molecular and evolut...,x,,,,,,,x,,,x,,,,,,,,,,,,x,2020-c-increased-power-and,Increased power and accuracy of causal locus identification in time-series genome-wide associatio...,2020,Increased power and accuracy of causal locus identification in time-series genome-wide associatio...,,x,,,,,x,,,,,,,,,,,,,,,x,x,